{
  "derived_generator_version": 1,
  "head_to_head_pairs": [
    {
      "g": 17,
      "l": 11,
      "opp": "Joe",
      "pct": 0.35294117647058826,
      "t": 0,
      "team": "Connor",
      "w": 6
    },
    {
      "g": 23,
      "l": 15,
      "opp": "Joel",
      "pct": 0.34782608695652173,
      "t": 0,
      "team": "Connor",
      "w": 8
    },
    {
      "g": 20,
      "l": 12,
      "opp": "Nuss",
      "pct": 0.4,
      "t": 0,
      "team": "Connor",
      "w": 8
    },
    {
      "g": 19,
      "l": 12,
      "opp": "Plot",
      "pct": 0.3684210526315789,
      "t": 0,
      "team": "Connor",
      "w": 7
    },
    {
      "g": 19,
      "l": 12,
      "opp": "Rishi",
      "pct": 0.3684210526315789,
      "t": 0,
      "team": "Connor",
      "w": 7
    },
    {
      "g": 19,
      "l": 12,
      "opp": "Shap",
      "pct": 0.3684210526315789,
      "t": 0,
      "team": "Connor",
      "w": 7
    },
    {
      "g": 3,
      "l": 3,
      "opp": "Shemer",
      "pct": 0,
      "t": 0,
      "team": "Connor",
      "w": 0
    },
    {
      "g": 18,
      "l": 11,
      "opp": "Singer",
      "pct": 0.3888888888888889,
      "t": 0,
      "team": "Connor",
      "w": 7
    },
    {
      "g": 2,
      "l": 0,
      "opp": "Snare",
      "pct": 1,
      "t": 0,
      "team": "Connor",
      "w": 2
    },
    {
      "g": 16,
      "l": 7,
      "opp": "Zook",
      "pct": 0.5625,
      "t": 0,
      "team": "Connor",
      "w": 9
    },
    {
      "g": 16,
      "l": 8,
      "opp": "Zubs",
      "pct": 0.5,
      "t": 0,
      "team": "Connor",
      "w": 8
    },
    {
      "g": 17,
      "l": 6,
      "opp": "Connor",
      "pct": 0.6470588235294118,
      "t": 0,
      "team": "Joe",
      "w": 11
    },
    {
      "g": 22,
      "l": 12,
      "opp": "Joel",
      "pct": 0.45454545454545453,
      "t": 0,
      "team": "Joe",
      "w": 10
    },
    {
      "g": 20,
      "l": 10,
      "opp": "Nuss",
      "pct": 0.5,
      "t": 0,
      "team": "Joe",
      "w": 10
    },
    {
      "g": 21,
      "l": 7,
      "opp": "Plot",
      "pct": 0.6666666666666666,
      "t": 0,
      "team": "Joe",
      "w": 14
    },
    {
      "g": 16,
      "l": 8,
      "opp": "Rishi",
      "pct": 0.5,
      "t": 0,
      "team": "Joe",
      "w": 8
    },
    {
      "g": 23,
      "l": 10,
      "opp": "Shap",
      "pct": 0.5652173913043478,
      "t": 0,
      "team": "Joe",
      "w": 13
    },
    {
      "g": 2,
      "l": 1,
      "opp": "Shemer",
      "pct": 0.5,
      "t": 0,
      "team": "Joe",
      "w": 1
    },
    {
      "g": 19,
      "l": 7,
      "opp": "Singer",
      "pct": 0.631578947368421,
      "t": 0,
      "team": "Joe",
      "w": 12
    },
    {
      "g": 2,
      "l": 2,
      "opp": "Snare",
      "pct": 0,
      "t": 0,
      "team": "Joe",
      "w": 0
    },
    {
      "g": 25,
      "l": 8,
      "opp": "Zook",
      "pct": 0.66,
      "t": 1,
      "team": "Joe",
      "w": 16
    },
    {
      "g": 18,
      "l": 11,
      "opp": "Zubs",
      "pct": 0.3888888888888889,
      "t": 0,
      "team": "Joe",
      "w": 7
    },
    {
      "g": 23,
      "l": 8,
      "opp": "Connor",
      "pct": 0.6521739130434783,
      "t": 0,
      "team": "Joel",
      "w": 15
    },
    {
      "g": 22,
      "l": 10,
      "opp": "Joe",
      "pct": 0.5454545454545454,
      "t": 0,
      "team": "Joel",
      "w": 12
    },
    {
      "g": 18,
      "l": 8,
      "opp": "Nuss",
      "pct": 0.5555555555555556,
      "t": 0,
      "team": "Joel",
      "w": 10
    },
    {
      "g": 26,
      "l": 11,
      "opp": "Plot",
      "pct": 0.5769230769230769,
      "t": 0,
      "team": "Joel",
      "w": 15
    },
    {
      "g": 18,
      "l": 5,
      "opp": "Rishi",
      "pct": 0.7222222222222222,
      "t": 0,
      "team": "Joel",
      "w": 13
    },
    {
      "g": 19,
      "l": 10,
      "opp": "Shap",
      "pct": 0.47368421052631576,
      "t": 0,
      "team": "Joel",
      "w": 9
    },
    {
      "g": 2,
      "l": 1,
      "opp": "Shemer",
      "pct": 0.5,
      "t": 0,
      "team": "Joel",
      "w": 1
    },
    {
      "g": 18,
      "l": 10,
      "opp": "Singer",
      "pct": 0.4444444444444444,
      "t": 0,
      "team": "Joel",
      "w": 8
    },
    {
      "g": 2,
      "l": 1,
      "opp": "Snare",
      "pct": 0.5,
      "t": 0,
      "team": "Joel",
      "w": 1
    },
    {
      "g": 20,
      "l": 11,
      "opp": "Zook",
      "pct": 0.45,
      "t": 0,
      "team": "Joel",
      "w": 9
    },
    {
      "g": 19,
      "l": 10,
      "opp": "Zubs",
      "pct": 0.47368421052631576,
      "t": 0,
      "team": "Joel",
      "w": 9
    },
    {
      "g": 20,
      "l": 8,
      "opp": "Connor",
      "pct": 0.6,
      "t": 0,
      "team": "Nuss",
      "w": 12
    },
    {
      "g": 20,
      "l": 10,
      "opp": "Joe",
      "pct": 0.5,
      "t": 0,
      "team": "Nuss",
      "w": 10
    },
    {
      "g": 18,
      "l": 10,
      "opp": "Joel",
      "pct": 0.4444444444444444,
      "t": 0,
      "team": "Nuss",
      "w": 8
    },
    {
      "g": 17,
      "l": 7,
      "opp": "Plot",
      "pct": 0.5882352941176471,
      "t": 0,
      "team": "Nuss",
      "w": 10
    },
    {
      "g": 23,
      "l": 11,
      "opp": "Rishi",
      "pct": 0.5217391304347826,
      "t": 0,
      "team": "Nuss",
      "w": 12
    },
    {
      "g": 16,
      "l": 11,
      "opp": "Shap",
      "pct": 0.3125,
      "t": 0,
      "team": "Nuss",
      "w": 5
    },
    {
      "g": 2,
      "l": 1,
      "opp": "Shemer",
      "pct": 0.5,
      "t": 0,
      "team": "Nuss",
      "w": 1
    },
    {
      "g": 18,
      "l": 10,
      "opp": "Singer",
      "pct": 0.4444444444444444,
      "t": 0,
      "team": "Nuss",
      "w": 8
    },
    {
      "g": 2,
      "l": 1,
      "opp": "Snare",
      "pct": 0.5,
      "t": 0,
      "team": "Nuss",
      "w": 1
    },
    {
      "g": 23,
      "l": 13,
      "opp": "Zook",
      "pct": 0.43478260869565216,
      "t": 0,
      "team": "Nuss",
      "w": 10
    },
    {
      "g": 27,
      "l": 18,
      "opp": "Zubs",
      "pct": 0.3333333333333333,
      "t": 0,
      "team": "Nuss",
      "w": 9
    },
    {
      "g": 19,
      "l": 7,
      "opp": "Connor",
      "pct": 0.631578947368421,
      "t": 0,
      "team": "Plot",
      "w": 12
    },
    {
      "g": 21,
      "l": 14,
      "opp": "Joe",
      "pct": 0.3333333333333333,
      "t": 0,
      "team": "Plot",
      "w": 7
    },
    {
      "g": 26,
      "l": 15,
      "opp": "Joel",
      "pct": 0.4230769230769231,
      "t": 0,
      "team": "Plot",
      "w": 11
    },
    {
      "g": 17,
      "l": 10,
      "opp": "Nuss",
      "pct": 0.4117647058823529,
      "t": 0,
      "team": "Plot",
      "w": 7
    },
    {
      "g": 20,
      "l": 10,
      "opp": "Rishi",
      "pct": 0.5,
      "t": 0,
      "team": "Plot",
      "w": 10
    },
    {
      "g": 22,
      "l": 10,
      "opp": "Shap",
      "pct": 0.5454545454545454,
      "t": 0,
      "team": "Plot",
      "w": 12
    },
    {
      "g": 3,
      "l": 0,
      "opp": "Shemer",
      "pct": 1,
      "t": 0,
      "team": "Plot",
      "w": 3
    },
    {
      "g": 15,
      "l": 4,
      "opp": "Singer",
      "pct": 0.7333333333333333,
      "t": 0,
      "team": "Plot",
      "w": 11
    },
    {
      "g": 3,
      "l": 3,
      "opp": "Snare",
      "pct": 0,
      "t": 0,
      "team": "Plot",
      "w": 0
    },
    {
      "g": 18,
      "l": 10,
      "opp": "Zook",
      "pct": 0.4444444444444444,
      "t": 0,
      "team": "Plot",
      "w": 8
    },
    {
      "g": 21,
      "l": 16,
      "opp": "Zubs",
      "pct": 0.23809523809523808,
      "t": 0,
      "team": "Plot",
      "w": 5
    },
    {
      "g": 19,
      "l": 7,
      "opp": "Connor",
      "pct": 0.631578947368421,
      "t": 0,
      "team": "Rishi",
      "w": 12
    },
    {
      "g": 16,
      "l": 8,
      "opp": "Joe",
      "pct": 0.5,
      "t": 0,
      "team": "Rishi",
      "w": 8
    },
    {
      "g": 18,
      "l": 13,
      "opp": "Joel",
      "pct": 0.2777777777777778,
      "t": 0,
      "team": "Rishi",
      "w": 5
    },
    {
      "g": 23,
      "l": 12,
      "opp": "Nuss",
      "pct": 0.4782608695652174,
      "t": 0,
      "team": "Rishi",
      "w": 11
    },
    {
      "g": 20,
      "l": 10,
      "opp": "Plot",
      "pct": 0.5,
      "t": 0,
      "team": "Rishi",
      "w": 10
    },
    {
      "g": 22,
      "l": 10,
      "opp": "Shap",
      "pct": 0.5454545454545454,
      "t": 0,
      "team": "Rishi",
      "w": 12
    },
    {
      "g": 1,
      "l": 0,
      "opp": "Shemer",
      "pct": 1,
      "t": 0,
      "team": "Rishi",
      "w": 1
    },
    {
      "g": 26,
      "l": 20,
      "opp": "Singer",
      "pct": 0.23076923076923078,
      "t": 0,
      "team": "Rishi",
      "w": 6
    },
    {
      "g": 1,
      "l": 0,
      "opp": "Snare",
      "pct": 1,
      "t": 0,
      "team": "Rishi",
      "w": 1
    },
    {
      "g": 18,
      "l": 9,
      "opp": "Zook",
      "pct": 0.5,
      "t": 0,
      "team": "Rishi",
      "w": 9
    },
    {
      "g": 20,
      "l": 9,
      "opp": "Zubs",
      "pct": 0.55,
      "t": 0,
      "team": "Rishi",
      "w": 11
    },
    {
      "g": 19,
      "l": 7,
      "opp": "Connor",
      "pct": 0.631578947368421,
      "t": 0,
      "team": "Shap",
      "w": 12
    },
    {
      "g": 23,
      "l": 13,
      "opp": "Joe",
      "pct": 0.43478260869565216,
      "t": 0,
      "team": "Shap",
      "w": 10
    },
    {
      "g": 19,
      "l": 9,
      "opp": "Joel",
      "pct": 0.5263157894736842,
      "t": 0,
      "team": "Shap",
      "w": 10
    },
    {
      "g": 16,
      "l": 5,
      "opp": "Nuss",
      "pct": 0.6875,
      "t": 0,
      "team": "Shap",
      "w": 11
    },
    {
      "g": 22,
      "l": 12,
      "opp": "Plot",